Keyword,Category,Intent,Difficulty,Priority
automatic water level controller,Water Level Controller,Commercial,Medium,High
best automatic water level controller,Water Level Controller,Commercial,Medium,High
water level controller for home,Water Level Controller,Commercial,Low,High
water tank overflow controller,Water Level Controller,Commercial,Low,High
automatic motor controller,Water Level Controller,Commercial,Medium,High
smart water level controller,Water Level Controller,Commercial,Medium,Medium
wireless water level controller,Water Level Controller,Commercial,Medium,Medium
industrial water level controller,Water Level Controller,Commercial,Medium,Medium
digital water level controller,Water Level Controller,Commercial,Low,Medium
water level controller installation,Water Level Controller,Informational,Low,High
water level controller wiring diagram,Water Level Controller,Informational,Low,High
water level controller working principle,Water Level Controller,Informational,Low,High
water level controller price,Water Level Controller,Commercial,Medium,High
water level controller for borewell,Water Level Controller,Commercial,Medium,High
water level controller for overhead tank,Water Level Controller,Commercial,Low,High
automatic pump controller,Water Level Controller,Commercial,Medium,High
pump dry run protection,Water Level Controller,Commercial,Medium,High
tank automation system,Water Level Controller,Informational,Low,Medium
water tank automation,Water Level Controller,Informational,Low,Medium
motor protection controller,Water Level Controller,Commercial,Medium,Medium
automatic water pump controller,Water Level Controller,Commercial,Medium,High
best water level controller in India,Water Level Controller,Commercial,Medium,High
water level monitoring system,Water Level Controller,Informational,Medium,Medium
electronic water level controller,Water Level Controller,Commercial,Low,Medium
float switch water level controller,Water Level Controller,Commercial,Medium,High
